Term,Title,URL
The BBC,BBC - Wikipedia,https://en.wikipedia.org/wiki/BBC
The BBC,The BBC,https://en.wikipedia.org/wiki/The_BBC
The BBC,Wikipedia BBC News - Wikipedia,https://en.wikipedia.org/wiki/BBC_News
The BBC,"BBC Home - Breaking News, World News, US News, Sports, Business ...",https://www.bbc.com/
The BBC,"BBC BBC News - Breaking news, video and the latest top stories from the U.S. and around the world",https://www.bbc.com/news
The BBC,World | Latest News & Updates - BBC,https://www.bbc.com/news/world
The BBC,BBC Live & Breaking World and U.S. News,https://www.bbc.com/live/news
The BBC,BBC leadership resignations: Turmoil after 'doctored' Trump speech,https://www.usatoday.com/story/news/world/2025/11/10/bbc-trump-gaza-bias-allegations/87191498007/
The BBC,Nandy says BBC must 'uphold highest standards' but warns against ...,https://www.bbc.co.uk/news/live/cd9kqz1yyxkt
The BBC,Learn more about what we do - BBC,https://www.bbc.com/aboutthebbc/
The BBC,Why the BBC Is Facing Its Gravest Crisis in Decades,https://www.nytimes.com/2025/11/10/world/europe/bbc-news-trump.html
The BBC,BBC's director and head of news resign amid Trump speech edit ...,https://www.cbsnews.com/news/bbc-director-tim-davie-head-of-news-deborah-turness-resignation-trump-speech-edit/
The BBC,YouTube BBC News - YouTube,https://www.youtube.com/user/bbcnews
The BBC,GOV.UK BBC - GOV.UK,https://www.gov.uk/government/organisations/bbc
The BBC,YouTube BBC - YouTube,https://www.youtube.com/channel/UCCj956IF62FbT7Gouszaj9w
The BBC,Instagram BBC (@bbc) • Instagram photos and videos,https://www.instagram.com/bbc/
The BBC,X BBC News (UK) (@BBCNews) / X,https://x.com/BBCNews
The BBC,The Guardian Can Donald Trump sue the BBC for $1bn and which party would win? | Donald Trump | The Guardian,https://www.theguardian.com/us-news/2025/nov/11/can-donald-trump-sue-bbc-which-party-would-win
The BBC,Facebook BBC News | London | Facebook,https://www.facebook.com/bbcnews/
The BBC,Google Play BBC: World News & Stories - Apps on Google Play,https://play.google.com/store/apps/details?id=bbc.mobile.news.ww&hl=en_US
Wike,WikEM,https://wikem.org/wiki/Main_Page
Wike,"Wike , military officer’s clash spark nationwide reactions",https://dailypost.ng/2025/11/12/wike-military-officers-clash-spark-nationwide-reactions/
Wike,UPDATED: Naval officers clash with Wike over alleged land ...,https://thenationonlineng.net/updated-naval-officers-clash-with-wike-over-alleged-land-development-in-abuja/
Wike,"Wike addresses clash with soldiers, vows to end illegal ...",https://www.premiumtimesng.com/regional/north-central/834770-wike-addresses-clash-with-soldiers-vows-to-end-illegal-buildings-in-abuja.html
Wike,Wike and military officer clash over Abuja land grabbing,https://punchng.com/video-wike-military-officer-clash-over-alleged-land-grabbing-in-abuja/
Wike,"Breaking: Soldiers Clash With Angry Wike , Block Him from ...",https://www.legit.ng/nigeria/1682833-breaking-fierce-drama-soldiers-block-angry-wike-accessing-fct-land-video-emerge/
Wike,"Wike , Military officers clash over alleged land grabbing in ...",https://guardian.ng/news/nigeria/metro/wike-military-officers-clash-over-alleged-land-grabbing-in-abuja/
Wike,"Soldiers Clash With FCT Minister Wike , FCTA Officials, Block ...",https://saharareporters.com/2025/11/11/soldiers-clash-fct-minister-wike-fcta-officials-block-them-accessing-land-abuja
Wike,Wike blows hot after tense confrontation with military ...,https://pmnewsnigeria.com/2025/11/11/wike-blows-hot-after-tense-confrontation-with-military-officers/
Wike,Wike apologises to Tinubu after Rivers women walk out on first lady,https://punchng.com/wike-apologises-to-tinubu-after-rivers-women-walk-out-on-first-lady/
Wike,"Nobody can be anything without me, Wike boasts",https://guardian.ng/news/nobody-can-be-anything-without-me-wike-boasts/
Wike,Mystery Surrounds Wike ’s Health: Did He Collapse or Is It... | Medium,https://medium.com/@FromLagosto/mystery-surrounds-wikes-health-did-he-collapse-or-is-it-mere-speculation-879a3779b918
Wike,"Lady Reacts as Wike Clashes With Soldier, Shares... - Legit.ng",https://www.legit.ng/people/1682863-sir-im-a-fool-lady-reacts-wike-clashes-soldier-shares-observation-viral-video/
Wike,Wike Threatens Buhari | Openlife Nigeria,https://openlife.ng/wike-threatens-buhari/
Wike,' Wike too busy to respond to Rivers opportunistic elders' - The Nation...,https://thenationonlineng.net/wike-too-busy-to-respond-to-rivers-opportunistic-elders/
Wike,Wike and Tales By Moonlight - By: . | Dailytrust,https://dailytrust.com/wike-and-tales-by-moonlight
Wike,"Wike , The Flame In The Rivers Fireworks - New Telegraph",https://newtelegraphng.com/wike-the-flame-in-the-rivers-fireworks/
Wike,Nyesom Wike video: FCT minister clash wit... - BBC News Pidgin,https://www.bbc.com/pidgin/articles/cx2nkqqrk7no
Wike,Nigerians who reject taxi driving at home embrace,https://tribuneonlineng.com/nigerians-who-reject-taxi-driving-at-home-embrace-it-abroad-wike/
Wike,Illegal Dev’t: Ex-Naval Chief Accused Of Mobilising Officers ...,https://newtelegraphng.com/illegal-devt-ex-naval-chief-accused-of-mobilising-officers-to-confront-wike/
#PMQs,PMQs,https://en.wikipedia.org/wiki/PMQs
#PMQs,Wikipedia Prime Minister's Questions - Wikipedia,https://en.wikipedia.org/wiki/Prime_Minister's_Questions
#PMQs,Wikipedia People's PMQs - Wikipedia,https://en.wikipedia.org/wiki/People's_PMQs
#PMQs,YouTube PMQs (Prime Minister's Questions) - YouTube,https://www.youtube.com/playlist?list=PL40441042C458B62B
#PMQs,The Guardian PMQs | The Guardian,https://www.theguardian.com/politics/pmqs
#PMQs,YouTube 🔴 PMQs LIVE: Prime Minister's Questions - 29 October 2025 - YouTube,https://www.youtube.com/watch?v=f7dvYT-S8ko
#PMQs,Apple Podcasts Official Prime Minister's Questions (PMQs) Podcast - Podcast - Apple Podcasts,https://podcasts.apple.com/us/podcast/official-prime-ministers-questions-pmqs-podcast/id444786081
#PMQs,The Telegraph PMQs - The Telegraph,https://www.telegraph.co.uk/pmqs/
#PMQs,Voting Counts What is Prime Minister's Questions (PMQs)? - Voting Counts,https://votingcounts.org.uk/pmqs
#PMQs,USAPP 60 years of Prime Minister’s Questions: seven changes that shaped PMQs | British Politics and Policy at LSE,https://blogs.lse.ac.uk/politicsandpolicy/60-years-pmqs/
#PMQs,Cambridge Dictionary PMQs | definition in the Cambridge English Dictionary,https://dictionary.cambridge.org/us/dictionary/english/pmqs
#PMQs,Player.fm Official Prime Minister's Questions (PMQs) podcast,https://player.fm/series/official-prime-ministers-questions-pmqs-podcast
#PMQs,Institute for Government Prime minister’s questions (PMQs) | Institute for Government,https://www.instituteforgovernment.org.uk/explainer/prime-ministers-questions-pmqs
#PMQs,PMQs LIVE: Wes Streeting slaps down 'Traitor' row as Keir Starmer faces ...,https://www.mirror.co.uk/news/politics/pmqs-live-wes-streeting-slaps-36231904
#PMQs,PMQs live: Kemi Badenoch presses Keir Starmer on winter fuel cuts,https://www.bbc.com/news/live/cdrgrjykymet
#PMQs,PMQS Live: Keir Starmer under fire as leadership crisis explodes ...,https://www.express.co.uk/news/politics/2132714/pmqs-live-keir-starmer-fire
#PMQs,Why isn't Prime Minister Keir Starmer at PMQs today as David Lammy ...,https://uk.news.yahoo.com/why-isnt-prime-minister-keir-115814224.html
#PMQs,PMQs review: David Lammy brawls with the house - New Statesman,https://www.newstatesman.com/politics/uk-politics/2025/11/pmqs-review-david-lammy-brawls-with-the-house
#PMQs,The Independent Watch live: Keir Starmer faces Kemi Badenoch at PMQs | The Independent,https://www.independent.co.uk/news/uk/politics/starmer-badenoch-rayner-pmqs-watch-live-b2819205.html
#PMQs,PMQs live: Keir Starmer says he 'never authorised' attacks on ... - BBC,https://www.bbc.co.uk/news/live/cp3x641k3y5t
Trump,Donald Trump,https://en.wikipedia.org/wiki/Donald_Trump
Trump,Presidency of Donald Trump - Wikipedia,https://en.wikipedia.org/wiki/Presidency_of_Donald_Trump
Trump,Donald Trump | Breaking News & Latest Updates | AP News,https://apnews.com/hub/donald-trump
Trump,"Trump says he'll issue $2,000 tariff dividend to all except ... President Trump on Veterans Day issues Victory Day message Google News - Donald Trump - Latest Donald Trump - The Washington Post",https://abcnews.go.com/Politics/trump-hell-issue-2000-tariff-dividend-except-high/story?id=127356839
Trump,President Trump on Veterans Day issues Victory Day message,https://www.usatoday.com/story/news/politics/2025/11/11/donald-trump-veterans-day-victory-day/87143390007/
Trump,Google News - Donald Trump - Latest,https://news.google.com/topics/CAAqIggKIhxDQkFTRHdvSkwyMHZNR054ZERrd0VnSmtaU2dBUAE
Trump,"Trump, 79, Panics About Losing His Supreme Court Fight in ...",https://www.yahoo.com/news/articles/trump-79-panics-losing-supreme-105559412.html?fr=sycsrp_catchall
Trump,Donald Trump - The Washington Post,https://www.washingtonpost.com/donald-trump/
Trump,"Trump, 79, Panics About Losing His Supreme Court Fight in Late ... - Yahoo",https://www.yahoo.com/news/articles/trump-79-panics-losing-supreme-105559412.html
Trump,Donald Trump News: Latest on the U.S. President | NBC News,https://www.nbcnews.com/politics/donald-trump
Trump,President Donald J. Trump - The White House,https://www.whitehouse.gov/administration/donald-j-trump/
Trump,Donald J. Trump news | CNN Politics,https://www.cnn.com/politics/president-donald-trump-47
Trump,Live updates: GOP takes stock after election sweep; Trump tariffs face ...,https://thehill.com/homenews/administration/5588571-live-updates-trump-shutdown-tariffs-supreme-court-election/
Trump,"Donald Trump - Latest news, photos and analysis of the former",https://www.mirror.co.uk/all-about/donald-trump
Trump,Donald Trump - The New York Times,https://www.nytimes.com/spotlight/donald-trump
Trump,Donald J. Trump: Campaign Website,https://www.donaldjtrump.com/
Trump,Donald Trump | Mediaite,https://www.mediaite.com/tag/donald-trump/
Trump,The Trump Organization | Luxury Real Estate Portfolio,https://www.trump.com/
Trump,Donald Trump - The Latest News from the UK and Around the World,https://news.sky.com/topic/donald-trump-5711/1
Trump,PolitiFact | Donald Trump,https://www.politifact.com/personalities/donald-trump/
Wes Streeting,Wes Streeting,https://en.wikipedia.org/wiki/Wes_Streeting
Wes Streeting,NBC News Wes Streeting denies plotting to oust PM Keir Starmer,https://www.nbcnews.com/world/united-kingdom/wes-streeting-denies-plotting-pm-keir-starmer-labour-rcna243399
Wes Streeting,Streeting denies plotting against PM after leadership claims,https://www.bbc.com/news/articles/c9v124znrgmo
Wes Streeting,UK Parliament Contact information for Wes Streeting - MPs and Lords - UK Parliament,https://members.parliament.uk/member/4504/contact
Wes Streeting,Wes Streeting - Deals on Wes Streeting,https://www.bing.com/aclick?ld=e8QUQK6FX9lGXTU9zad5UOszVUCUxvGfaiZ4yy1IW8Vq8hKN2fUXXsgr7KOClIA1nS_L0qjFi0k8ZBDY8ba9uI7zHmhGUva0NMKZuvCfuJHF2IIa8kBfhr_vPB2j9PCpW2Gy4_bSz_cXGQYbphe8W8RtKrtbWhZ3kkHcWAz7koUNVTzZUC_p8pq1Qjvl1ysQf838D0JlTPFoyjelWoySH1yQ9mWWk&u=aHR0cHMlM2ElMmYlMmZ3d3cuYW1hem9uLmNvbSUyZnMlMmYlM2ZpZSUzZFVURjglMjZrZXl3b3JkcyUzZHdlcyUyYnN0cmVldGluZyUyNmluZGV4JTNkYXBzJTI2dGFnJTNkbWgwYi0yMCUyNnJlZiUzZHBkX3NsXzhreGRjYWY2MXZfZSUyNmFkZ3JwaWQlM2QxMzMxNTA5MTQzNjYzMjAxJTI2aHZhZGlkJTNkODMyMTk1NjA2NDI2NjQlMjZodm5ldHclM2RvJTI2aHZxbXQlM2RlJTI2aHZibXQlM2RiZSUyNmh2ZGV2JTNkYyUyNmh2bG9jaW50JTNkJTI2aHZsb2NwaHklM2Q2NzExMyUyNmh2dGFyZ2lkJTNka3dkLTgzMjIwNTEzNjIzODY5JTNhbG9jLTE5MCUyNmh5ZGFkY3IlM2QyMjUzMl8xMzQ5NDQ0OCUyNm1jaWQlM2Q0NDZkNDA3N2ZmZTAzYzZlYmZmZDcyMjM2YjIxNTI3YyUyNm1zY2xraWQlM2RiZGE2Yzg3MmViYTYxZTI3MDExMWExNjY3ZDg2OTA4MA&rlid=bda6c872eba61e270111a1667d869080
Wes Streeting,Wes Streeting demands sackings in No 10 after he’s accused of ...,https://www.independent.co.uk/news/uk/politics/wes-streeting-keir-starmer-prime-minister-coup-plot-b2863567.html
Wes Streeting,Wes Streeting warns 'traitors' against 'self-defeating' plot ...,https://www.mirror.co.uk/news/politics/breaking-wes-streeting-denies-plot-36231313
Wes Streeting,UK politics live: Wes Streeting denies plan to challenge ...,https://www.ft.com/content/9eb606b3-a6d0-4c30-9bd2-ad9f3e9cbd74
Wes Streeting,Wes Streeting insists he is not trying to oust Sir Keir Starmer,https://news.sky.com/story/wes-streeting-insists-he-is-not-trying-to-oust-sir-keir-starmer-13468923
Wes Streeting,Wes Streeting : The new health secretary tasked with... | Sky News,https://news.sky.com/story/who-is-wes-streeting-the-new-health-secretary-tasked-with-overseeing-nhs-policy-13131107
Wes Streeting,Streeting denies plot to oust Starmer and condemns... | The Guardian,https://www.theguardian.com/politics/2025/nov/12/wes-streeting-denies-plotting-oust-keir-starmer-prime-minister
Wes Streeting,Wes Streeting : The man who can - Magazine,https://magazine.unison.org.uk/2024/05/28/wes-streeting-the-man-who-can/
Wes Streeting,Wes Streeting - Mirror,https://www.mirror.co.uk/authors/wes-streeting/
Wes Streeting,Wes Streeting denies plot to oust Keir Starmer as... | Daily Mail Online,https://www.dailymail.co.uk/news/article-15283077/Wes-Streeting-denies-plot-oust-Keir-Starmer-Prime-Minister-insisiting-someones-watching-Celebrity-Traitors.html
Wes Streeting,Wes Streeting Denies Plot to Replace Keir Starmer as... - Bloomberg,https://www.bloomberg.com/news/articles/2025-11-12/streeting-denies-plot-to-replace-starmer-as-uk-prime-minister
Wes Streeting,Instagram Wes Streeting MP (@wesstreeting) • Instagram photos and videos,https://www.instagram.com/wesstreeting/
Wes Streeting,GOV.UK The Rt Hon Wes Streeting MP - GOV.UK,https://www.gov.uk/government/people/wes-streeting
Wes Streeting,The Spectator Only Wes Streeting came out well from PMQs | The Spectator,https://www.spectator.co.uk/article/only-wes-streeting-came-out-well-from-pmqs/
Wes Streeting,X Wes Streeting (@wesstreeting) / X,https://x.com/wesstreeting?lang=en
Wes Streeting,The Guardian Wes Streeting | The Guardian,https://www.theguardian.com/politics/wes-streeting
WASPI,WASPI,https://en.wikipedia.org/wiki/WASPI
WASPI,What is WASPI and Why We are Fighting for it? | by Waspi | Medium,https://medium.com/@infowaspi/what-is-waspi-and-why-we-are-fighting-for-it-745d8d8c4276
WASPI,"WASPI - News, views, pictures, video - The Mirror",https://www.mirror.co.uk/all-about/waspi
WASPI,UK to reconsider decision to deny Waspi women... | The Guardian,https://www.theguardian.com/money/2025/nov/11/uk-to-reconsider-decision-to-deny-waspi-women-pension-payouts
WASPI,What is a Waspi woman and what happened to them? | Sky News,https://news.sky.com/story/what-is-a-waspi-woman-and-what-happened-to-them-13099258
WASPI,Waspi women threaten legal action after pension payouts rejected,https://www.bbc.com/news/articles/cwyjx9dn38wo
WASPI,"WASPI - News, views, pictures, video - Manchester Evening News",https://www.manchestereveningnews.co.uk/all-about/waspi
WASPI,WASPI women could get DWP payout - check if you're... | Devon Live,https://www.devonlive.com/news/cost-of-living/waspi-women-could-dwp-payout-9184971
WASPI,Try our WASPI calculator to see how much you're owed in DWP payout,https://www.nottinghampost.com/news/cost-of-living/waspi-calculator-shows-how-much-9185004
WASPI,Waspi women criticise ‘bizarre and unjustified’ ruling out of...,https://www.nationalworld.com/news/politics/waspi-women-criticise-bizarre-and-unjustified-ruling-out-of-compensation-4914114
WASPI,WASPI says 'it means so much' as it hits DWP compensation goal,https://www.bristolpost.co.uk/news/cost-of-living/waspi-says-it-means-much-10580222
WASPI,"ASIO, WASAPI, Direct Sound... is there any difference in sound …",https://www.audiosciencereview.com/forum/index.php?threads/asio-wasapi-direct-sound-is-there-any-difference-in-sound-quality.7029/page-11
WASPI,"ASIO, WASAPI, Direct Sound... is there any difference in sound …",https://www.audiosciencereview.com/forum/index.php?threads/asio-wasapi-direct-sound-is-there-any-difference-in-sound-quality.7029/
WASPI,Get the best sound quality in windows using wasapi,https://www.audiosciencereview.com/forum/index.php?threads/get-the-best-sound-quality-in-windows-using-wasapi.5272/
WASPI,Does ASIO or WASAPI really optimize sound quality?,https://www.audiosciencereview.com/forum/index.php?threads/does-asio-or-wasapi-really-optimize-sound-quality.24455/
WASPI,Wasapi driver with Foobar2000 - Audio Science Review (ASR) …,https://www.audiosciencereview.com/forum/index.php?threads/wasapi-driver-with-foobar2000.30608/
WASPI,"Kernel Streaming, ASIO, WASAPI... and music players (Foobar, …",https://www.audiosciencereview.com/forum/index.php?threads/kernel-streaming-asio-wasapi-and-music-players-foobar-jriver.7412/
WASPI,Equalizer APO & WASAPI - Audio Science Review (ASR) Forum,https://www.audiosciencereview.com/forum/index.php?threads/equalizer-apo-wasapi.17075/
WASPI,Exclusive mode from web based players - Audio Science Review …,https://www.audiosciencereview.com/forum/index.php?threads/exclusive-mode-from-web-based-players.30876/
WASPI,"ASIO, WASAPI, Direct Sound... is there any difference in sound …",https://www.audiosciencereview.com/forum/index.php?threads/asio-wasapi-direct-sound-is-there-any-difference-in-sound-quality.7029/page-10
