Rank,Term,ResultIndex,Title,URL,Timestamp
1,Epstein,1,Jeffrey Epstein - Wikipedia,https://en.wikipedia.org/wiki/Jeffrey_Epstein,2025-11-15T14:11:46Z
1,Epstein,2,Multi-disciplinary Design and Construction | Epstein,https://www.epsteinglobal.com/,2025-11-15T14:11:46Z
1,Epstein,3,"Indictment, JEFFREY EPSTEIN",https://www.justice.gov/usao-sdny/press-release/file/1180481/dl,2025-11-15T14:11:46Z
1,Epstein,4,Jeffrey Epstein cultivated celebrity relationships for years. Many ...,https://www.cbsnews.com/news/jeffrey-epstein-celebrity-relationships-documents/,2025-11-15T14:11:46Z
1,Epstein,5,Who was Jeffrey Epstein? The disgraced financier with powerful ...,https://www.bbc.com/news/world-us-canada-48913377,2025-11-15T14:11:46Z
1,Epstein,6,Listen To The Jeffrey Epstein Tapes: 'I Was Donald Trump's Closest ...,https://docs.house.gov/meetings/JU/JU08/20250227/117951/HHRG-119-JU08-20250227-SD006-U6.pdf,2025-11-15T14:11:46Z
1,Epstein,7,Oversight Committee Releases Additional Epstein Estate Documents,https://oversight.house.gov/release/oversight-committee-releases-additional-epstein-estate-documents/,2025-11-15T14:11:46Z
1,Epstein,8,What do we know about the Jeffrey Epstein files?,https://www.bbc.com/news/articles/c20r07dg6kro,2025-11-15T14:11:46Z
1,Epstein,9,Epstein Becker Green - Law Firm,https://www.ebglaw.com/,2025-11-15T14:11:46Z
1,Epstein,10,Harvey Epstein - Assembly District 74 |Assembly Member Directory ...,https://nyassembly.gov/mem/Harvey-Epstein/contact/,2025-11-15T14:11:46Z
1,Epstein,11,Watch Jeffrey Epstein: Filthy Rich | Netflix Official Site,https://www.netflix.com/title/80224905,2025-11-15T14:11:46Z
1,Epstein,12,Text - H.R.4405 - 119th Congress (2025-2026): Epstein Files ...,https://www.congress.gov/bill/119th-congress/house-bill/4405/text,2025-11-15T14:11:46Z
1,Epstein,13,Harvey Epstein - Assembly District 74 |Assembly Member Directory ...,https://nyassembly.gov/mem/Harvey-Epstein,2025-11-15T14:11:46Z
1,Epstein,14,Text - H.Res.581 - 119th Congress (2025-2026): Providing for ...,https://www.congress.gov/bill/119th-congress/house-resolution/581/text,2025-11-15T14:11:46Z
1,Epstein,15,Jason I. Epstein - Nelson Mullins,https://www.nelsonmullins.com/professionals/jason-epstein,2025-11-15T14:11:46Z
1,Epstein,16,Right-wing media downplays latest Epstein documents : NPR,https://www.npr.org/2025/11/15/nx-s1-5608227/epstein-emails-qanon-influencers,2025-11-15T14:11:46Z
1,Epstein,17,Richard Epstein - Overview | NYU School of Law,https://its.law.nyu.edu/facultyprofiles/index.cfm?fuseaction=profile.overview&personid=26355,2025-11-15T14:11:46Z
1,Epstein,18,Shira Eve Epstein | The City College of New York,https://www.ccny.cuny.edu/profiles/shira-eve-epstein,2025-11-15T14:11:46Z
1,Epstein,19,Dr. Marc E. Epstein,https://www.cdfa.ca.gov/plant/ppd/staff/mepstein.html,2025-11-15T14:11:46Z
1,Epstein,20,House Oversight Committee Releases Jeffrey Epstein Email ...,https://oversightdemocrats.house.gov/news/press-releases/house-oversight-committee-releases-jeffrey-epstein-email-correspondence-raising,2025-11-15T14:11:46Z
2,#ITAvRSA,1,Chemistry off the charts ‍ #RWC2025 #ITAvRSA,https://www.facebook.com/rugbyworldcup/posts/chemistry-off-the-charts-rwc2025-itavrsa/1209155277917656/,2025-11-15T14:11:51Z
2,#ITAvRSA,2,Handre Pollard gets the game underway in Turin #Springboks ...,https://x.com/Springboks/status/1989675182491840833/photo/1,2025-11-15T14:11:51Z
2,#ITAvRSA,3,"Next up, the Italian Job. #ITAvRSA",https://www.facebook.com/RugbyMadsa/posts/%EF%B8%8F-next-up-the-italian-job-itavrsa/1306424998165482/,2025-11-15T14:11:51Z
2,#ITAvRSA,4,Italy announce their team to take on Springboks! #ITAvRSA,https://x.com/PlanetRugby/status/1988950634117374002,2025-11-15T14:11:51Z
2,#ITAvRSA,5,A Sunday to remember in South African history ‍ Congratulations to ...,https://www.instagram.com/p/DOBsBoqCJib/?hl=en,2025-11-15T14:11:51Z
2,#ITAvRSA,6,Handre Pollard starts in much-changed Springboks side! #ITAvRSA,https://x.com/PlanetRugby/status/1988946033838330092,2025-11-15T14:11:51Z
2,#ITAvRSA,7,This is a golden opportunity for Italy to beat the Springboks as they ...,https://www.instagram.com/p/DQ_xvVGlhAm/,2025-11-15T14:11:51Z
2,#ITAvRSA,8,Post by #RugbyItaly on X: #ITAvRSA,https://x.com/RugbyIta/status/1989367988076818640,2025-11-15T14:11:51Z
2,#ITAvRSA,9,Post by #RugbyItaly on X: #ITAvRSA,https://x.com/RugbyIta/status/1989083268306841962,2025-11-15T14:11:51Z
2,#ITAvRSA,10,#ITAvRSA That is support cool @elementofuoco #RugbyItaly,https://x.com/RugbyIta/status/1989420193995788680,2025-11-15T14:11:51Z
2,#ITAvRSA,11,#ITAvRSA Preview Pod We talk Hookers The Hoodie Potential Our ...,https://x.com/RugbyBits/status/1989042826156351586,2025-11-15T14:11:51Z
2,#ITAvRSA,12,#ITAvRSA Fresh Springboks lineup! Kolisi captains a new-look side ...,https://x.com/RugbyIta/status/1989015551000092980/photo/1,2025-11-15T14:11:51Z
2,#ITAvRSA,13,#ITAvRSA caps vs bulls ?,https://x.com/RugbyIta/status/1989079756630008115,2025-11-15T14:11:51Z
2,#ITAvRSA,14,"Ange Capuozzo stuns South Africa, just like Australia last week ...",https://x.com/RugbyPass/status/1593956532215062532?ref_src=twsrc%5Etfw,2025-11-15T14:11:51Z
2,#ITAvRSA,15,#ITAvRSA MATCH DAY! Italy vs South Africa in Turin. After beating ...,https://x.com/RugbyIta/status/1989591169622241646/photo/1,2025-11-15T14:11:51Z
2,#ITAvRSA,16,Kickoff day! Your prediction? #BringingPeopleTogether #Springboks ...,https://x.com/SpurRestaurant/status/1989666145339900285,2025-11-15T14:11:51Z
2,#ITAvRSA,17,"TEAM: Unsurprisingly, Italy have been reluctant to make any ...",https://x.com/RugbyPass/status/1988938378201690336,2025-11-15T14:11:51Z
2,#ITAvRSA,18,Springboks Squad that will face Italy today. #ITAvRSA #QuilterNS ...,https://x.com/sin_bin_rugby/status/1989541716475457849,2025-11-15T14:11:51Z
2,#ITAvRSA,19,Post by #RugbyItaly on X: #ITAvRSA,https://x.com/RugbyIta/status/1989083080297267629,2025-11-15T14:11:51Z
2,#ITAvRSA,20,Someone please stop laba bafana baseSouth Africa #ITAvRSA ...,https://x.com/SiboMaputi/status/1989007175382131190,2025-11-15T14:11:51Z
3,#totp,1,"""#TOTP"" - Results on X | Live Posts & Updates",https://x.com/search?q=%23TOTP,2025-11-15T14:11:55Z
3,#totp,2,On using bitwarden for TOTP: : r/Bitwarden,https://www.reddit.com/r/Bitwarden/comments/10qfts6/on_using_bitwarden_for_totp/,2025-11-15T14:11:55Z
3,#totp,3,Online one-time password generator / TOTP (Google Authenticator ...,https://totp.app/,2025-11-15T14:11:55Z
3,#totp,4,Why doesn't Bitwarden auto-fill TOTP codes? : r/Bitwarden,https://www.reddit.com/r/Bitwarden/comments/1ildptt/why_doesnt_bitwarden_autofill_totp_codes/,2025-11-15T14:11:55Z
3,#totp,5,I lost my TOTP key and recovery code - How to Use GitLab - GitLab ...,https://forum.gitlab.com/t/i-lost-my-totp-key-and-recovery-code/42320,2025-11-15T14:11:55Z
3,#totp,6,Support Microsoft TOTP for office 365 (business) - Password ...,https://community.bitwarden.com/t/support-microsoft-totp-for-office-365-business/372,2025-11-15T14:11:55Z
3,#totp,7,TOTP tokens on my wrist with the smartest dumb watch. // flurries of ...,https://blog.singleton.io/posts/2022-10-17-otp-on-wrist/,2025-11-15T14:11:55Z
3,#totp,8,Getting TOTP to work on PC is a nightmare with Bitwarden ...,https://community.bitwarden.com/t/getting-totp-to-work-on-pc-is-a-nightmare-with-bitwarden/78554,2025-11-15T14:11:55Z
3,#totp,9,How can I change my TOTP? - Auth0 Community,https://community.auth0.com/t/how-can-i-change-my-totp/99746,2025-11-15T14:11:55Z
3,#totp,10,TOTP verification code incorrect in desktop app - Password ...,https://community.bitwarden.com/t/totp-verification-code-incorrect-in-desktop-app/86559,2025-11-15T14:11:55Z
3,#totp,11,My #TOTP debut solo performance for 'Love Train' Those green ...,https://www.instagram.com/reel/CoaPZDjI7mo/,2025-11-15T14:11:55Z
3,#totp,12,TOTP for 2 users sharing plan - Password Manager - Bitwarden ...,https://community.bitwarden.com/t/totp-for-2-users-sharing-plan/35895,2025-11-15T14:11:55Z
3,#totp,13,TOTP context menu greyed out. Cannot add a new TOTP to every ...,https://github.com/keepassxreboot/keepassxc/discussions/11043,2025-11-15T14:11:55Z
3,#totp,14,Can I Create QR from TOTP? - Password Manager - Bitwarden ...,https://community.bitwarden.com/t/can-i-create-qr-from-totp/15060,2025-11-15T14:11:55Z
3,#totp,15,Feature request: Support for TOTP with custom encoders - Like ...,https://www.1password.community/discussions/1password/feature-request-support-for-totp-with-custom-encoders---like-steam/142973,2025-11-15T14:11:55Z
3,#totp,16,Bitwarden TOTP not working - Password Manager - Bitwarden ...,https://community.bitwarden.com/t/bitwarden-totp-not-working/61941,2025-11-15T14:11:55Z
3,#totp,17,TOTP suddenly not working - ℹ️ Support - Nextcloud community,https://help.nextcloud.com/t/totp-suddenly-not-working/10771,2025-11-15T14:11:55Z
3,#totp,18,Handling TOTP - Questions / Help - Elixir Programming Language ...,https://elixirforum.com/t/handling-totp/38516,2025-11-15T14:11:55Z
3,#totp,19,TOTP autocopy - Kee browser extension - Kee community forum,https://forum.kee.pm/t/totp-autocopy/3317,2025-11-15T14:11:55Z
3,#totp,20,protocol design - Security concern with TOTP - Cryptography Stack ...,https://crypto.stackexchange.com/questions/51287/security-concern-with-totp,2025-11-15T14:11:55Z
4,Storm Claudia,1,List of storms named Claudia - Wikipedia,https://en.wikipedia.org/wiki/List_of_storms_named_Claudia,2025-11-15T14:11:59Z
4,Storm Claudia,2,Storm Claudia : r/Dublin,https://www.reddit.com/r/Dublin/comments/1owr97y/storm_claudia/,2025-11-15T14:11:59Z
4,Storm Claudia,3,Storm Claudia: More rain forecast for Saturday before cold snap hits ...,https://www.bbc.com/news/articles/c4gw5xxej04o,2025-11-15T14:11:59Z
4,Storm Claudia,4,Obituary information for Claudia Marie (Turco) Storm,https://www.sheehanhilbornbreen.com/obituaries/Claudia-Marie-Turco-Storm?obId=34294843,2025-11-15T14:11:59Z
4,Storm Claudia,5,What's your plan for Storm Claudia? : r/UKWeather,https://www.reddit.com/r/UKWeather/comments/1owqv5o/whats_your_plan_for_storm_claudia/,2025-11-15T14:11:59Z
4,Storm Claudia,6,Storm Claudia: major incident declared after severe flooding in UK ...,https://www.theguardian.com/uk-news/2025/nov/15/maybe-storm-claudia-england-weather-major-incident-flooding,2025-11-15T14:11:59Z
4,Storm Claudia,7,Further flooding in England likely from Storm Claudia - GOV.UK,https://www.gov.uk/government/news/further-flooding-in-england-likely-from-storm-claudia,2025-11-15T14:11:59Z
4,Storm Claudia,8,Weather warnings as Spain's Storm Claudia reaches UK on Friday ...,https://www.theguardian.com/uk-news/2025/nov/13/weather-warnings-storm-claudia-flood-rain-wind,2025-11-15T14:11:59Z
4,Storm Claudia,9,Storm Claudia Updates - Monmouthshire,https://www.monmouthshire.gov.uk/storm-claudia/,2025-11-15T14:11:59Z
4,Storm Claudia,10,'Do not travel' warning issued for rail passengers as Storm Claudia ...,https://www.the-independent.com/travel/news-and-advice/storm-claudia-train-cancellations-delays-b2865184.html,2025-11-15T14:11:59Z
4,Storm Claudia,11,Storm Claudia: More rain forecast for Saturday before cold snap hits ...,https://www.bbc.co.uk/news/articles/c4gw5xxej04o,2025-11-15T14:11:59Z
4,Storm Claudia,12,Storm Claudia - Tram and Bus Disruption | Bee Network | Powered ...,https://tfgm.com/storm-claudia,2025-11-15T14:11:59Z
4,Storm Claudia,13,Storm Claudia to bring heavy and disruptive rain for many - Met Office,https://www.metoffice.gov.uk/about-us/news-and-media/media-centre/weather-and-climate-news/2025/storm-claudia-to-bring-heavy-and-disruptive-rain-for-many,2025-11-15T14:11:59Z
4,Storm Claudia,14,Heavy rain affecting Ireland on Friday 14th November 2025 ...,https://www.met.ie/meteorologists-commentary/heavy-rain-affecting-ireland-on-friday-14th-november-2025-associated-with-storm-claudia/,2025-11-15T14:11:59Z
4,Storm Claudia,15,Portugal remains on alert as Storm Claudia moves towards UK ...,https://www.euronews.com/2025/11/14/portugal-remains-on-alert-as-storm-claudia-moves-towards-uk,2025-11-15T14:11:59Z
4,Storm Claudia,16,Storm Claudia map: Where 150mm of rain could fall today as flood ...,https://www.the-independent.com/news/uk/home-news/storm-claudia-map-uk-weather-warnings-b2865146.html,2025-11-15T14:11:59Z
4,Storm Claudia,17,"Storm Claudia, named by the Spanish Met Service, will affect the UK ...",https://www.facebook.com/metoffice/posts/storm-claudia-named-by-the-spanish-met-service-will-affect-the-uk-on-friday-heav/1266216802207048/,2025-11-15T14:11:59Z
4,Storm Claudia,18,Storm Claudia: Several counties still under rain alert with flood risk ...,https://www.irishtimes.com/ireland/2025/11/15/weather-ireland-storm-claudia-triggers-significant-flooding-and-impassible-roads/,2025-11-15T14:11:59Z
4,Storm Claudia,19,Storm Claudia: Major incident is declared with 90 flood warnings in ...,https://www.dailymail.co.uk/news/article-15293587/Storm-Claudia-Major-incident-declared-90-flood-warnings-place-authorities-warn-significant-risk-life-cold-snap-snow-way.html,2025-11-15T14:11:59Z
4,Storm Claudia,20,Storm Claudia: Reduced service on Friday 14 November 2025 ...,https://www.chilternrailways.co.uk/stormclaudia,2025-11-15T14:11:59Z
5,#SmackDown,1,SmackDown | WWE,https://www.wwe.com/shows/smackdown,2025-11-15T14:12:04Z
5,#SmackDown,2,How to deal with Treebranch Smackdown? : r/darkestdungeon,https://www.reddit.com/r/darkestdungeon/comments/s7qvb4/how_to_deal_with_treebranch_smackdown/,2025-11-15T14:12:04Z
5,#SmackDown,3,No Credentials? No entry! #Smackdown,https://www.instagram.com/p/DKBJtoKOp4u/?hl=en,2025-11-15T14:12:04Z
5,#SmackDown,4,Why was Smackdown only 1 hour and 20 minutes?,https://www.facebook.com/groups/ManiaClub/posts/4196745473935676/,2025-11-15T14:12:04Z
5,#SmackDown,5,The Blue Crew! #wwe #smackdown,https://www.instagram.com/p/CeosvqvJ8je/,2025-11-15T14:12:04Z
5,#SmackDown,6,#LAKnight #Smackdown,https://www.facebook.com/LAKnightWWE/posts/laknight-smackdown/764919089025008/,2025-11-15T14:12:04Z
5,#SmackDown,7,Inanimate Smackdown/Transcript | Inanimate Insanity Wiki | Fandom,https://inanimateinsanity.fandom.com/wiki/Inanimate_Smackdown/Transcript,2025-11-15T14:12:04Z
5,#SmackDown,8,For the Toledo/LowerMichigan Peeps #SmackDown #toledo,https://www.facebook.com/groups/ManiaClub/posts/4215895712020652/,2025-11-15T14:12:04Z
5,#SmackDown,9,WWE SmackDown - Wikipedia,https://en.wikipedia.org/wiki/WWE_SmackDown,2025-11-15T14:12:04Z
5,#SmackDown,10,Why does it take a month for Smackdown episodes to replay on ...,https://www.facebook.com/groups/ManiaClub/posts/4143651085911782/,2025-11-15T14:12:04Z
5,#SmackDown,11,WWE SmackDown | MVP Arena,https://www.mvparena.com/events/detail/wwe-smackdown-nov-14,2025-11-15T14:12:04Z
5,#SmackDown,12,This was very easily the BEST episode of SmackDown this year so ...,https://www.facebook.com/WWEHeelYARD/posts/this-was-very-easily-the-best-episode-of-smackdown-this-year-so-farsmackdown-is-/1280329153880108/,2025-11-15T14:12:04Z
5,#SmackDown,13,WWE SmackDown,https://www.vanandelarena.com/events/2025/wwe-smackdown2,2025-11-15T14:12:04Z
5,#SmackDown,14,Steam Workshop::Undead Smackdown,https://steamcommunity.com/sharedfiles/filedetails/?id=424063762,2025-11-15T14:12:04Z
5,#SmackDown,15,Foodie Tasting Events in New Mexico | Let the smackdown begin!,https://ediblesmackdown.com/,2025-11-15T14:12:04Z
5,#SmackDown,16,WWE Friday Night SmackDown | Bon Secours Wellness Arena,https://www.bonsecoursarena.com/events/detail/wwe-friday-night-smackdown-greenville-tickets,2025-11-15T14:12:04Z
5,#SmackDown,17,WWE® & Big 12 Conference to Bring Friday Night Smackdown to ...,https://big12sports.com/news/2025/7/8/wwe-big-12-conference-to-bring-friday-night-smackdown-to-big-12-markets-during-2025-college-football-season.aspx,2025-11-15T14:12:04Z
5,#SmackDown,18,"""#smackdown"" - Results on X | Live Posts & Updates",https://x.com/hashtag/smackdown,2025-11-15T14:12:04Z
5,#SmackDown,19,WWE Friday Night SmackDown | T-Mobile Arena,https://www.t-mobilearena.com/events/detail/wwe-friday-night-smackdown-1,2025-11-15T14:12:04Z
5,#SmackDown,20,Smackdown Cancer | Riley Children's Foundation,https://rileykids.org/get-involved/events/smackdown-cancer-2,2025-11-15T14:12:04Z
6,July Flower,1,July Birth Flowers: Larkspur and Water Lily | The Old Farmer's ...,https://www.almanac.com/content/july-birth-flowers,2025-11-15T14:12:08Z
6,July Flower,2,July Birth Flower: What is my Birth Flower?,https://www.gardenia.net/guide/july-birth-flower-what-is-my-birth-flower,2025-11-15T14:12:08Z
6,July Flower,3,"Independence Fest 2026 | Flower Mound, TX - Official Website",https://www.flower-mound.com/festival,2025-11-15T14:12:08Z
6,July Flower,4,July Birth Flower Meanings: Larkspur & Water Lily | Floraly,https://www.floraly.com.au/blogs/news/july-birth-flowers-water-lily-larkspur,2025-11-15T14:12:08Z
6,July Flower,5,4th of July Flowers | Patriotic Flowers for Independence Day | Teleflora,https://www.teleflora.com/independence-day-flowers?catID=cat210083,2025-11-15T14:12:08Z
6,July Flower,6,Fourth of July Flowers | Kroger,https://flowers.kroger.com/collections/independenceday,2025-11-15T14:12:08Z
6,July Flower,7,"4th of July Flower Arrangements | Ridge, NY - National Floral Design",https://nationalfloraldesign.com/july-4th/,2025-11-15T14:12:08Z
6,July Flower,8,"Fourth of July Flowers in Philadelphia, PA | Same Day Fourth of July ...",https://www.pflorist.com/fourth-of-july/de-100244,2025-11-15T14:12:08Z
6,July Flower,9,4th of July Flowers | Patriotic Flowers | 1800Flowers,https://www.1800flowers.com/fourth-of-july,2025-11-15T14:12:08Z
6,July Flower,10,Early July Blooms in My Flower Garden - The Martha Stewart Blog,https://www.themarthablog.com/2018/07/early-july-blooms-in-my-flower-garden.html,2025-11-15T14:12:08Z
6,July Flower,11,4th of July Flowers : r/flowers,https://www.reddit.com/r/flowers/comments/14qg6gj/4th_of_july_flowers/,2025-11-15T14:12:08Z
6,July Flower,12,Late July Blooms in My Flower Garden - The Martha Stewart Blog,https://www.themarthablog.com/2019/07/late-july-blooms-in-my-flower-garden.html,2025-11-15T14:12:08Z
6,July Flower,13,Fourth of July Feature in Boston MA - Winston Flowers,https://www.winstonflowers.com/flower-arrangement/fourth-of-july-feature/prod7690134,2025-11-15T14:12:08Z
6,July Flower,14,4th of July Flower Delivery | Flower Shopping,https://www.flowershopping.com/upcoming-holidays/4th-of-july,2025-11-15T14:12:08Z
6,July Flower,15,Homeyer: July flowers worth growing - Concord Monitor,https://www.concordmonitor.com/2025/07/05/homeyer-july-flowers-worth-growing-62139826/,2025-11-15T14:12:08Z
6,July Flower,16,"4+ Hundred July Birth Flower Royalty-Free Images, Stock Photos ...",https://www.shutterstock.com/search/july-birth-flower,2025-11-15T14:12:08Z
6,July Flower,17,"July 4th Flowers in Cedar Rapids, IA - Pierson's Flower Shop ...",https://www.piersonsflowershop.com/july-4th,2025-11-15T14:12:08Z
6,July Flower,18,4th of July Flowers | St Augustine FL | Flower Works | 904-824-7806,https://www.thenaturalflorist.com/product-category/holidays-flower-gifts/4th-of-july-flowers/,2025-11-15T14:12:08Z
6,July Flower,19,Fourth of July Hawaiian Flower Shower - Kaanapali Resort,https://kaanapaliresort.com/fourth-of-july-hawaiian-flower-shower/,2025-11-15T14:12:08Z
6,July Flower,20,Hi Flower Friends! What did you spend your July Dollars on?,https://www.facebook.com/woldhuisfarms/posts/hi-flower-friendswhat-did-you-spend-your-july-dollars-on-/1206714981480318/,2025-11-15T14:12:08Z
7,Children in Need,1,BBC Children in Need: We're there for you,https://www.bbcchildreninneed.co.uk/,2025-11-15T14:12:12Z
7,Children in Need,2,Children In Need Washington County | Caring for our future - our ...,https://childreninneedwashingtoncounty.org/,2025-11-15T14:12:12Z
7,Children in Need,3,Children in Need - Wikipedia,https://en.wikipedia.org/wiki/Children_in_Need,2025-11-15T14:12:12Z
7,Children in Need,4,BBC Children in Need - BBC,https://www.bbc.co.uk/programmes/b008dk4b,2025-11-15T14:12:12Z
7,Children in Need,5,Donate to BBC Children in Need,https://donate.bbcchildreninneed.co.uk/,2025-11-15T14:12:12Z
7,Children in Need,6,BBC Children in Need - BBC iPlayer,https://www.bbc.co.uk/iplayer/episodes/b008dk4b/bbc-children-in-need,2025-11-15T14:12:12Z
7,Children in Need,7,"Children In Need, Inc.",https://www.sandiegocounty.gov/content/sdc/hhsa/programs/cs/children_in_need.html,2025-11-15T14:12:12Z
7,Children in Need,8,Children in Need 2025 raises more than £45m,https://www.bbc.com/news/articles/c3vn0np7pewo,2025-11-15T14:12:12Z
7,Children in Need,9,"BBC Children in Need, 2025, Live Show - BBC",https://www.bbc.co.uk/programmes/m002m4d4,2025-11-15T14:12:12Z
7,Children in Need,10,"Children in need, Reporting year 2023 - Explore education statistics ...",https://explore-education-statistics.service.gov.uk/find-statistics/children-in-need/2023,2025-11-15T14:12:12Z
7,Children in Need,11,Children in Need of Supervision (CINS) Program | Prince George's ...,https://www.princegeorgescountymd.gov/departments-offices/boards-commissions/children-youth-families-division-local-management-board/children-need-support-cins-program,2025-11-15T14:12:12Z
7,Children in Need,12,CHILDREN IN NEED OF SERVICES: - A Guide to Cases under ...,https://www.law.uga.edu/sites/default/files/Guide%20to%20Children%20In%20Need%20of%20Services%20Procedures%20in%20Georgia's%20New%20Juvenile%20Code.pdf,2025-11-15T14:12:12Z
7,Children in Need,13,Children in Need of Supervision (CINS) | The Maryland People's ...,https://www.peoples-law.org/children-need-supervision-cins,2025-11-15T14:12:12Z
7,Children in Need,14,BBC Children in Need (@bbccin) • Instagram photos and videos,https://www.instagram.com/bbccin/?hl=en,2025-11-15T14:12:12Z
7,Children in Need,15,Children in Need of Assistance (CINA) | The Maryland People's Law ...,https://www.peoples-law.org/children-need-assistance-cina,2025-11-15T14:12:12Z
7,Children in Need,16,"Children In Need, Inc. | Hagerstown MD",https://www.facebook.com/CINwashco/,2025-11-15T14:12:12Z
7,Children in Need,17,Review of children in need - GOV.UK,https://www.gov.uk/government/publications/review-of-children-in-need/review-of-children-in-need,2025-11-15T14:12:12Z
7,Children in Need,18,New York Children in Need,https://www.osc.ny.gov/files/reports/pdf/nys-children-in-need.pdf,2025-11-15T14:12:12Z
7,Children in Need,19,Children in Need of Services,https://www.jud11.flcourts.org/Children-in-Need-of-Services,2025-11-15T14:12:12Z
7,Children in Need,20,Children in Need of Supervision (CINS) Complaint Process,https://djs.maryland.gov/Documents/JJRC/Children-in-Need-of-Supervision-Complaint-Process.pdf,2025-11-15T14:12:12Z
8,#BBUK,1,Big Brother UK (@bbuk) / Posts / X,https://x.com/bbuk?lang=en,2025-11-15T14:12:17Z
8,#BBUK,2,Big Brother UK (@bbuk) • Instagram photos and videos,https://www.instagram.com/bbuk/?hl=en,2025-11-15T14:12:17Z
8,#BBUK,3,Big Brother UK,https://www.reddit.com/r/bigbrotheruk/,2025-11-15T14:12:17Z
8,#BBUK,4,BB on Blast: Big Brother Podcast #BBUK (@BBonblast) / Posts / X,https://x.com/BBonblast,2025-11-15T14:12:17Z
8,#BBUK,5,Why did BBUS never have the same cultural impact that BBUK did ...,https://www.reddit.com/r/BigBrother/comments/fu89rn/why_did_bbus_never_have_the_same_cultural_impact/,2025-11-15T14:12:17Z
8,#BBUK,6,"Big Brother UK on Instagram: ""George and Teja debate politics ...",https://www.linkedin.com/posts/aisha-thomas-b9786946_big-brother-uk-on-instagram-george-and-activity-7379276482239545345-CnF4,2025-11-15T14:12:17Z
8,#BBUK,7,"2024 is the first year where BBCAN, BBUS, BBUK were all won by ...",https://www.reddit.com/r/BigBrother/comments/1gt49kr/2024_is_the_first_year_where_bbcan_bbus_bbuk_were/,2025-11-15T14:12:17Z
8,#BBUK,8,ITV - Meet the housemates… and non-housemates 👁️ #bbuk ...,https://www.facebook.com/photo.php?fbid=1073596404126517&id=100044285026961&set=a.804516587701168,2025-11-15T14:12:17Z
8,#BBUK,9,Big Brother UK (franchise) | Big Brother Wiki | Fandom,https://bigbrother.fandom.com/wiki/Big_Brother_UK_(franchise),2025-11-15T14:12:17Z
8,#BBUK,10,Demons can't keep a diva down x #BBUK,https://www.facebook.com/story.php?story_fbid=1368282971325112&id=100044302665512,2025-11-15T14:12:17Z
8,#BBUK,11,Bladder & Bowel UK,https://www.bbuk.org.uk/,2025-11-15T14:12:17Z
8,#BBUK,12,Big Brother (British TV series) - Wikipedia,https://en.wikipedia.org/wiki/Big_Brother_(British_TV_series),2025-11-15T14:12:17Z
8,#BBUK,13,BBUK LIMITED overview - Find and update company information ...,https://find-and-update.company-information.service.gov.uk/company/10871685,2025-11-15T14:12:17Z
8,#BBUK,14,BBUK Studio | BBUK,https://www.bbukstudio.com/,2025-11-15T14:12:17Z
8,#BBUK,15,BBUK CARS LIMITED overview - Find and update company ...,https://find-and-update.company-information.service.gov.uk/company/09948542,2025-11-15T14:12:17Z
8,#BBUK,16,BBUK Heritage Days 2025,https://www.bnaibrithuk.org/bbuk-heritage-days-2025,2025-11-15T14:12:17Z
8,#BBUK,17,'BBUK' Live Launch Shocks With Night 1 Twist That Puts ...,https://deadline.com/2025/09/bbuk-live-launch-shocks-eviction-night-1-1236563531/,2025-11-15T14:12:17Z
8,#BBUK,18,BBUK Plc pro forma,https://home.barclays/content/dam/home-barclays/documents/investor-relations/annualreports/ar2017/22%2002%2018%20Barclays%20Bank%20UK%20PLC%20Pro%20forma.pdf,2025-11-15T14:12:17Z
8,#BBUK,19,ITV2 Reveals 'Big Brother UK' Eye Logo For 2026,https://deadline.com/gallery/big-brother-uk-2025-eye-logo-itv2/,2025-11-15T14:12:17Z
8,#BBUK,20,ELEKTRONIK - SCHWARZBECK MESS,http://schwarzbeck.de/Datenblatt/91149139.pdf,2025-11-15T14:12:17Z
9,Northern Soul,1,Northern soul - Wikipedia,https://en.wikipedia.org/wiki/Northern_soul,2025-11-15T14:12:21Z
9,Northern Soul,2,Northern Soul Grilled Cheese: Northern Soul Manchester,https://www.northernsoulmcr.com/,2025-11-15T14:12:21Z
9,Northern Soul,3,Northern Soul (2014) - IMDb,https://www.imdb.com/title/tt1837613/,2025-11-15T14:12:21Z
